<?xml version="1.0" encoding="UTF-8"?>
<dataroot xmlns:od="urn:schemas-microsoft-com:officedata" xmlns:xsi="http://www.w3.org/2001/XMLSchema-instance"  xsi:noNamespaceSchemaLocation="PassiveNameTable.xsd" generated="2017-05-25T13:03:32">
<PassiveNameTable>
<ID>1</ID>
<GivenID>1</GivenID>
<PassiveName>Blessing</PassiveName>
</PassiveNameTable>
<PassiveNameTable>
<ID>2</ID>
<GivenID>2</GivenID>
<PassiveName>Injury</PassiveName>
</PassiveNameTable>
<PassiveNameTable>
<ID>3</ID>
<GivenID>3</GivenID>
<PassiveName>Sword</PassiveName>
</PassiveNameTable>
<PassiveNameTable>
<ID>4</ID>
<GivenID>4</GivenID>
<PassiveName>Armor</PassiveName>
</PassiveNameTable>
<PassiveNameTable>
<ID>5</ID>
<GivenID>5</GivenID>
<PassiveName>HealingPotion</PassiveName>
</PassiveNameTable>
<PassiveNameTable>
<ID>6</ID>
<GivenID>6</GivenID>
<PassiveName>Bread</PassiveName>
</PassiveNameTable>
<PassiveNameTable>
<ID>7</ID>
<GivenID>7</GivenID>
<PassiveName>KoboldMeet</PassiveName>
</PassiveNameTable>
<PassiveNameTable>
<ID>8</ID>
<GivenID>8</GivenID>
<PassiveName>TrollMeet</PassiveName>
</PassiveNameTable>
</dataroot>
